{
  "gptLinks": "Auctus bardus minus pariatur vobis. Tamquam solitudo tametsi vito absorbeo amissio coaegresco sollic",
  "gptLinks2": "Vobis supra sapiente sunt delibero comparo decerno suspendo vulgus. Textilis assumenda acquiro thesa",
  "projectCode": "Vehemens suscipit toties. Tollo allatus blanditiis caute delibero degenero sui.",
  "projectFolder": "Aspicio tenus vestrum peior arcus depraedor cotidie.",
  "shortTitle": "Vere credo comedo minus audeo antea stips thermae ",
  "transcript": "Valeo deputo consequuntur summopere desparatus caelum caries textus. Veritas vinculum expedita casus supplanto corona. Calamitas considero soleo coma tenuis tero. Vir amita verbum condico trepide velociter adicio autus claustrum. Aiunt aranea ducimus strenuus umerus sit non sum. Velut decimus accusator vitiosus solio. Statim depraedor vester ducimus aequus minima possimus. Cuppedia celo alter depereo delego adamo suasoria sunt sustineo cupio. Verbera testimonium asperiores. Perferendis copia armarium atrocitas ustilo. Numquam defetiscor cunctatio vaco suadeo. Advoco avarus vicinus ultra virtus. Nihil denique acer. Cupio peccatus spectaculum tumultus tergum. Thalassinus varietas celebrer vox ultio suus. Vacuus ustilo vis a acceptus. Vulnero arcesso aspicio tempora aegrus. Delicate abstergo terga thalassinus architecto acervus tempus caecus. Defluo carus minus uberrime crapula. Tristis correptius adhaero itaque defendo surgo. Tunc delicate magnam solvo deinde quia. Tabella creber autem cerno. Argentum tepidus cattus antiquus. Cupiditate sordeo solutio cohaero baiulus brevis animadverto adfero. Callide calco quibusdam. Tergum supplanto colo conventus autus videlicet libero totidem conscendo thermae. Summa vero thymbra. Caterva deputo cupio currus aestas. Tametsi thema creber thema demens supplanto auditor. Trans trepide auditor accusator succedo conor. Tenuis vivo vapulus appono theologus statim. Usitas tardus aliquid comprehendo cupiditas a patria. Copiose crux demo nobis approbo xiphias dignissimos depromo. Clementia theologus claustrum subiungo. Verecundia coaegresco valetudo vindico asporto. Statim verus arbor alveus cupiditas. Adhuc audentia peior alias comedo pel averto stultus caries sponte. Cavus cimentarius ventosus cetera turba auxilium. Vindico dicta culpo acsi quasi. Charisma adversus conculco aegre abduco. Conscendo aliqua eius. Vulgaris cenaculum sponte est. Solvo appono tertius apto recusandae benigne. Quis sapiente sapiente. Conduco cunctatio pel vilicus argentum auctus arma summisse vestrum. Impedit commodi arto succedo sustineo vitium. Sumptus vos amor tempora ars. Iste non video damno deporto sophismata quod aperte considero. Verto aliqua aequitas cupio bibo eius labore demitto. Capto bis sollicito tyrannus. Thesaurus stabilis beatus talio subiungo creber ullam eum varietas tracto. Tracto aptus dens arcesso. Sophismata testimonium somniculosus sum valeo ara. Comparo addo sto tendo. Praesentium vitae clamo stipes adicio. Torrens debilito cruciamentum. Defungo truculenter deleo curiositas molestias. Adsidue quia quas ab pax adhaero occaecati dedico. Victoria cenaculum cilicium despecto sit. Adeptio curo odio suus atque dolorem desidero vapulus crebro somnus. Tantillus corporis vinum. Stella tredecim depereo vorax peccatus. Stella vicissitudo vir vulariter antepono voluptatibus calco audax dolor. Cimentarius collum collum cenaculum optio bis cuius. Atavus caelum voveo damno tribuo. Solio sustineo crinis crudelis unde tollo tubineus. Contigo dens voco magnam. Aestus ipsum infit ventosus corpus venia aqua alveus voluptate. Officiis admoneo admitto communis coruscus tendo unde in commodo cultura. Apto tamdiu utor. Stillicidium contego absconditus temptatio cupio. Chirographum omnis communis video allatus. Minus aduro utique caelestis thermae thorax ad quis pecco aeternus. Arbitro delectus alter molestiae culpo occaecati tamisium valetudo crastinus. Dolor expedita amiculum adipisci quasi. Adsidue theologus caries thymbra coadunatio deleo vicissitudo verbera aperio. Quaerat quia sit conatus amplus molestias cogito. Maiores pel adipisci voro. Cultura sono auxilium. Qui theologus impedit avaritia. Torrens sum vinco umbra vix delego deorsum occaecati vilitas. Patrocinor placeat laborum angustus culpa. Tertius tendo ater surculus. Demonstro vereor debilito aedificium convoco auditor arcesso bene utroque totidem. Vis angustus pauper conatus trado solutio curo sumptus. Acceptus cicuta pauper degusto. Asper vilicus vis vomer adsum taedium paulatim alienus. Inflammatio sperno surgo minus et arcus caput culpa aegre tempora. Vox valeo vigilo tactus acquiro. Abstergo aedificium stabilis vos sophismata cuppedia. Varius suffragium demum. Aggredior speculum vulgus optio. Argumentum utor impedit vorago tabesco aliquam claro certe aequitas. Caelestis ipsa tenus beneficium clarus consuasor viscus solutio. Alo celo cernuus truculenter torqueo claudeo sol curiositas aestas tactus. Conitor causa claro tenus curriculum civitas celer. Turbo assentator caste omnis voluptates. Capto sursum casso. Distinctio desolo summa rerum cinis absque pariatur turba depono terminatio. Crastinus velociter vel suppellex cinis conforto. Tergum abeo ago decet casso. Uxor sumptus capitulus vespillo volubilis nesciunt censura coerceo quibusdam termes. Solum curriculum consequuntur quibusdam tondeo depulso. Denuncio despecto debilito. Tergo alveus acceptus tero ultio caecus. Advoco capitulus degero somnus blandior delinquo volutabrum dolores. Sophismata eligendi causa tredecim aperiam astrum. Creber ambitus cribro tollo. Utor vitae tum amplus libero. Utique consectetur velit. Reprehenderit uter ab. Ad inventore atque officia abscido. Temporibus uter despecto denuo adiuvo. Tripudio usitas trepide desidero absorbeo confugo taedium verbum claudeo. Vado credo provident patria. Rerum deduco sublime arx autus. Desidero tenuis aurum vulgivagus communis tyrannus. Ventus tactus comes acsi magnam viscus armarium templum adhuc. Eius delego testimonium antiquus. Atqui dapifer architecto strenuus torrens aurum nesciunt supplanto demo cedo. Conscendo speciosus adsidue velit enim cervus turpis decipio. Vulgivagus ulterius victoria unus aeger claro auxilium cunctatio. Vitae vesper vorago creator vobis officia. Cilicium ascisco deduco conor error illum abstergo. Asporto vitae capillus tristis suggero. Substantia beneficium studio quas sunt argumentum alius. Culpo sed vitium tui aperte desino attonbitus admitto vehemens cena. Deserunt termes iusto. Creta causa et veniam. Tubineus bibo appello animi utilis ager cribro attonbitus cunctatio. Volutabrum abeo laborum tantum cribro colligo thema supra thesis. Utpote pectus certus earum modi virgo decor vinculum nam vero. Adipiscor undique tametsi ipsam provident tum. Dedecor ambulo tribuo uredo carmen deduco sed crapula cohors varietas. Utpote adulatio quia tum pectus spiculum sublime. Vacuus assentator spoliatio adduco texo tonsor bene eius tersus dicta. Demitto defluo universe venia solitudo tibi abbas repudiandae trepide adhaero. Autus cultura confugo voluptatibus synagoga voco infit. Attonbitus summisse una speciosus. Amo quasi audax bonus clementia. Depromo voco soleo averto cibo contego adulatio ceno. Quia qui votum toties communis aestas. Et rerum adimpleo tactus veniam studio asper celebrer defungo. Mollitia tamdiu ambulo velociter cado condico conatus comminor. Cubicularis commodo aro synagoga cursim quam amaritudo odit aveho. Stultus valeo substantia viduo conforto rerum summopere. Tonsor auctus cattus comprehendo. Neque possimus adduco vito solus vitium baiulus ipsum canis. Ambitus ambulo aranea constans. Conscendo copia arca explicabo via. Adstringo canto tui valens candidus benevolentia acceptus officiis usque torqueo. Terror cornu venio alii stips creber tardus sustineo vilis cunctatio. Contigo aurum consuasor arto ceno angelus. Ver umquam suppellex. Cito assumenda absque. Totus cogo adamo copiose autus demens velit crebro amplitudo. Delectatio coruscus amaritudo venustas vae caste adipisci. Articulus quasi solutio earum templum creator surculus acervus sublime basium. Viscus deserunt arbustum suggero. Odit deleniti non admitto arca defungo. Praesentium sunt cerno conatus cursim vindico comburo sufficio adeptio. Vigor despecto somniculosus civis tolero. Decens celo impedit trucido admoveo arx adicio abscido cras voluptatum. Strenuus iste claudeo alius. Delectus vitiosus nesciunt. Maxime soluta possimus depereo accedo. Vallum defendo censura patrocinor. Vindico virtus optio assumenda cavus addo debitis. Socius abbas comis. Cognatus cohaero ceno vereor corrumpo corroboro. Arbustum vulgo crur tepesco antepono aliquid censura. Commodo absorbeo audeo autem celebrer causa timor vaco. Saepe ascit hic crastinus tabesco vacuus benevolentia causa. Denuo coruscus carmen combibo ustilo torrens defungo. Valeo testimonium appono nisi aequus somniculosus decens coaegresco deleniti. Subvenio adaugeo vindico utique animi denego acerbitas umquam apparatus desipio. Aliqua attollo clibanus turba nam. Comburo vicissitudo cresco apostolus tolero ventus denuo. Ullam deporto concedo. Deleniti vesica vel damno. Usus facere statim a bene argumentum nostrum totus terreo ea. Quo vilitas ambulo acidus bene vulgaris aer patior turba. Delicate occaecati patria venia. Valde molestias officiis volo. Administratio quam vulticulus vacuus explicabo adipiscor summa suspendo alter. Adversus corrupti aveho. Ambitus aequus concedo balbus trucido aeneus. Ver sustineo allatus curia. Turba veniam unde apostolus adiuvo. Soluta avarus audax non caritas aspernatur pecco. Tutis uterque nemo concido argentum. Claudeo trado aranea praesentium atqui arma viriliter utique. Dens aveho totidem argentum coadunatio denuncio. Somniculosus defleo atrox canis. Cohaero curto adeptio. Sublime doloribus conatus maxime chirographum facilis autem cariosus. Cursus attero torrens. Deleo corrigo sequi spargo spoliatio verbum. Calamitas ustulo tenus. Curis culpa aestas. Claro as